{
  "$schema": "../../../schemas/v1/review-evidence.schema.json",
  "schema_version": "1.0.0",
  "evidence_pack_id": "amp-2026-dogfood-001-reviewer-evidence",
  "envelope_id": "AMP-2026-DOGFOOD-001-reviewer",
  "task_id": "AMP-2026-DOGFOOD-001",
  "role": "reviewer",
  "reviewer_id": "codex-independent-phase0-reviewer",
  "review_of": "d472d02d5b23de43280ef7d78c7c851ed1b9ab2d",
  "governance_commit": "3ab73de9c65d0f1be0177b293dab6cbaf710e29b",
  "independence_attestation": "A separate read-only reviewer inspected the exact commit and made no workspace, Git, deployment, provider, or financial changes.",
  "reviewed_at": "2026-09-04T11:35:38.1322034-03:00",
  "findings": [],
  "contrary_evidence": [
    "The declarative Phase Zero controls do not yet prove authorization, isolation, retrieval safety, retention enforcement, or customer value in a future runtime.",
    "Sanitization remains a repository assertion and every client-facing or cross-project reuse still requires human security, privacy, ownership, and contractual review.",
    "Python 3.13 was unavailable in the review host, so the executor's successful Python 3.13.9 full-gate result was assessed as explicit environment-specific evidence rather than reproduced there.",
    "CodeQL analysis passed, while its SARIF upload remains intentionally non-enforcing in the current workflow."
  ],
  "validation": [
    "Phase Zero validation passed with 16 compiled schemas, 7 capabilities, 3 evidence records, and 5 known errors.",
    "The review gate correctly blocked the reviewed core commit because the evidence pack belongs only in its governed child commit.",
    "Foundation validation, targeted Prettier validation, and pnpm audit passed.",
    "All nine GitHub checks passed on the reviewed head, including container startup, liveness, non-root execution, Trivy, Gitleaks, dependency fallback, and CodeQL.",
    "Known-error evidence IDs resolve through the project index, and schema plus negative fixtures enforce resolved, validated, sanitized, selected-solution, and customer-reuse invariants.",
    "The merged architecture baseline has the same tree as the corrected pre-squash branch and is an ancestor of the reviewed follow-up."
  ],
  "unresolved_blocking_findings": [],
  "confidence": "high",
  "verdict": "pass",
  "limitations": [
    "The PASS covers repository-only Phase Zero architecture, known-error learning, and governance artifacts; it does not authorize merge, deployment, production, cloud/provider resources, customer reuse, acceptance, or financial actions.",
    "A future runtime must separately prove project isolation, retrieval authorization, retention enforcement, and safe client-facing projections."
  ]
}
